{
  "$schema": "./project.config.schema.json",
  "name": "phonebook-webapp",
  "title": "Phonebook Web App",
  "description": "Example phonebook web app for Cisco Collaboration Devices",
  "author": "William Mills",
  "org": "wxsd-sales",
  "repo": "phonebook-webapp",
  "webapp": true,
  "buttonName": "Phone Book",
  "buttonIcon": "Handset",
  "buttonLocation": "HomeScreen",
  "phonebookRootUrl": "",
  "autoCloseSeconds": 0
}
